{
  "schemaVersion": "1.0.0",
  "tool": {
    "name": "PSCP",
    "version": "4.0.0",
    "mode": "static-only",
    "targetWasExecuted": false,
    "testsWereExecuted": false
  },
  "verdict": "BLOCK",
  "exitCode": 2,
  "analysisComplete": true,
  "safeToBeginSandboxTesting": false,
  "malwareAssessment": "NoStaticIndicatorsDetected",
  "summary": {
    "directAnswer": "Do not run this script yet. 1 blocking finding(s) require remediation or explicit security review.",
    "recommendedAction": "Fix critical/error findings and rerun PSCP. Escalate malware or credential-access indicators for security review.",
    "filesAnalyzed": 1,
    "totalFindings": 17,
    "reportedFindings": 17,
    "blockingFindings": 1,
    "suppressedFindings": 0,
    "bySeverity": {
      "Critical": 0,
      "Error": 1,
      "Warning": 16,
      "Information": 0
    }
  },
  "request": {
    "paths": [
      "C:\\Users\\BenFlanagan\\Documents\\Codex\\2026-08-27\\https-github-com-benflanagan-ziaas-ziaas\\work\\audit-target\\PSCP_v3_4.ps1"
    ],
    "profile": "Standard",
    "dependencyMode": "Require",
    "minimumReportedSeverity": "Information",
    "recurse": true,
    "limits": {
      "maxFileCount": 5000,
      "maxFileBytes": 10485760,
      "maxDecodedBytes": 1048576,
      "maxDecodeDepth": 3
    }
  },
  "timing": {
    "startedUtc": "2026-08-27T09:52:10.9563455Z",
    "finishedUtc": "2026-08-27T09:52:20.3523599Z",
    "durationMs": 9396
  },
  "environment": {
    "powerShellVersion": "7.6.4",
    "edition": "Core",
    "platform": "Microsoft Windows NT 10.0.26200.0",
    "processArchitecture": "x64"
  },
  "coverage": [
    {
      "name": "PowerShell.Parser+PSCP.Custom",
      "status": "completed",
      "required": true,
      "version": "7.6.4",
      "durationMs": 4384,
      "message": "Parser and bundled static rules completed without executing target code.",
      "details": {
        "filesRequested": 1,
        "filesAnalyzed": 1,
        "decodedArtifacts": 0
      }
    },
    {
      "name": "Dependency:PSScriptAnalyzer",
      "status": "completed",
      "required": true,
      "version": "1.25.0",
      "durationMs": 670,
      "message": "Pinned PSGallery dependency loaded by exact manifest path after identity and signature validation.",
      "details": {
        "manifestPath": "C:\\Users\\BenFlanagan\\OneDrive - ZiAAS\\Documents\\PowerShell\\Modules\\PSScriptAnalyzer\\1.25.0\\PSScriptAnalyzer.psd1",
        "manifestSha256": "2B219F688BCDD67101040F845E530B22907D39BBF49089B4B5B2AFABA7996791",
        "signaturesChecked": 20
      }
    },
    {
      "name": "PSScriptAnalyzer",
      "status": "completed",
      "required": true,
      "version": "1.25.0",
      "durationMs": 3997,
      "message": "All requested PSScriptAnalyzer passes completed.",
      "details": [
        {
          "name": "Default",
          "status": "completed",
          "diagnostics": 0,
          "durationMs": 3495,
          "message": ""
        },
        {
          "name": "ScriptSecurity",
          "status": "completed",
          "diagnostics": 0,
          "durationMs": 278,
          "message": ""
        },
        {
          "name": "ScriptFunctions",
          "status": "completed",
          "diagnostics": 0,
          "durationMs": 219,
          "message": ""
        }
      ]
    }
  ],
  "files": [
    {
      "fullPath": "C:\\Users\\BenFlanagan\\Documents\\Codex\\2026-08-27\\https-github-com-benflanagan-ziaas-ziaas\\work\\audit-target\\PSCP_v3_4.ps1",
      "relativePath": "work\\audit-target\\PSCP_v3_4.ps1",
      "sha256": "37486AC4BEB02814E9122FD681B1A27196CF8E792823F8B17C865A30A050CC7A",
      "sizeBytes": 22681,
      "extension": ".ps1",
      "encoding": "utf-8-no-bom",
      "authenticode": {
        "available": true,
        "status": "NotSigned",
        "signer": "",
        "timestamp": ""
      },
      "parser": {
        "success": true,
        "errorCount": 0,
        "tokenCount": 3669
      },
      "statistics": {
        "lines": 102,
        "commands": 156,
        "functions": 8,
        "parameters": 30
      },
      "dependencies": {
        "requiredPowerShellVersion": "",
        "requiredModules": [],
        "importedModules": [
          "PSScriptAnalyzer"
        ],
        "moduleQualifiedCommands": [],
        "nativeCommands": [],
        "dynamicCommandLines": [],
        "resolutionNote": "Command/module resolution is intentionally not performed because discovery can import modules or run module initialization code."
      },
      "functions": [
        {
          "name": "Get-PSCPCount",
          "lineStart": 9,
          "lineEnd": 9,
          "lines": 1,
          "parameters": [
            {
              "name": "Value",
              "type": "System.Object",
              "mandatory": false,
              "valueFromPipeline": false,
              "valueFromPipelineByPropertyName": false,
              "validations": [],
              "hasDefault": false,
              "line": 9
            }
          ],
          "supportsShouldProcess": false,
          "usesShouldProcess": false,
          "hasProcessBlock": false,
          "complexity": 1,
          "maximumNestingDepth": 0,
          "calls": [],
          "scopeWrites": [],
          "outputProperties": [],
          "hasCommentHelp": false
        },
        {
          "name": "Get-PSCPProp",
          "lineStart": 10,
          "lineEnd": 10,
          "lines": 1,
          "parameters": [
            {
              "name": "Object",
              "type": "System.Object",
              "mandatory": false,
              "valueFromPipeline": false,
              "valueFromPipelineByPropertyName": false,
              "validations": [],
              "hasDefault": false,
              "line": 10
            },
            {
              "name": "Name",
              "type": "System.String",
              "mandatory": false,
              "valueFromPipeline": false,
              "valueFromPipelineByPropertyName": false,
              "validations": [
                "ValidateNotNullOrEmpty"
              ],
              "hasDefault": false,
              "line": 10
            }
          ],
          "supportsShouldProcess": false,
          "usesShouldProcess": false,
          "hasProcessBlock": false,
          "complexity": 3,
          "maximumNestingDepth": 1,
          "calls": [],
          "scopeWrites": [],
          "outputProperties": [],
          "hasCommentHelp": false
        },
        {
          "name": "Get-PSCPLocation",
          "lineStart": 11,
          "lineEnd": 11,
          "lines": 1,
          "parameters": [
            {
              "name": "Text",
              "type": "System.String",
              "mandatory": false,
              "valueFromPipeline": false,
              "valueFromPipelineByPropertyName": false,
              "validations": [
                "ValidateNotNull"
              ],
              "hasDefault": false,
              "line": 11
            },
            {
              "name": "Index",
              "type": "System.Int32",
              "mandatory": false,
              "valueFromPipeline": false,
              "valueFromPipelineByPropertyName": false,
              "validations": [],
              "hasDefault": false,
              "line": 11
            }
          ],
          "supportsShouldProcess": false,
          "usesShouldProcess": false,
          "hasProcessBlock": false,
          "complexity": 2,
          "maximumNestingDepth": 1,
          "calls": [
            "Get-PSCPCount"
          ],
          "scopeWrites": [],
          "outputProperties": [
            "Column",
            "Line"
          ],
          "hasCommentHelp": false
        },
        {
          "name": "Get-PSCPRating",
          "lineStart": 12,
          "lineEnd": 12,
          "lines": 1,
          "parameters": [
            {
              "name": "Score",
              "type": "System.Int32",
              "mandatory": false,
              "valueFromPipeline": false,
              "valueFromPipelineByPropertyName": false,
              "validations": [],
              "hasDefault": false,
              "line": 12
            }
          ],
          "supportsShouldProcess": false,
          "usesShouldProcess": false,
          "hasProcessBlock": false,
          "complexity": 5,
          "maximumNestingDepth": 1,
          "calls": [],
          "scopeWrites": [],
          "outputProperties": [],
          "hasCommentHelp": false
        },
        {
          "name": "Add-PSCPFinding",
          "lineStart": 13,
          "lineEnd": 13,
          "lines": 1,
          "parameters": [
            {
              "name": "File",
              "type": "System.String",
              "mandatory": false,
              "valueFromPipeline": false,
              "valueFromPipelineByPropertyName": false,
              "validations": [
                "ValidateNotNullOrEmpty"
              ],
              "hasDefault": false,
              "line": 13
            },
            {
              "name": "Severity",
              "type": "System.String",
              "mandatory": false,
              "valueFromPipeline": false,
              "valueFromPipelineByPropertyName": false,
              "validations": [
                "ValidateSet"
              ],
              "hasDefault": false,
              "line": 13
            },
            {
              "name": "Area",
              "type": "System.String",
              "mandatory": false,
              "valueFromPipeline": false,